{
  "version": "1",
  "sac_id": "fc294f3d-de2a-419c-b285-eed4049707f3",
  "created_at": "2026-03-18T18:37:25.667321Z",
  "root_key": {
    "key_id": "fc462ae1-2ced-4cd9-9299-122ef5bea90a",
    "key_bytes": "KmWzRbxStezQJxpN1QY5j8+KfRxmQ6ONP6FGwLcus6w=",
    "created_at": "2026-03-18T18:37:25.667303Z",
    "rotated_at": null
  },
  "memory_root": {
    "memory_id": "14ec4a68-182d-4fc0-a937-6c445742f73d",
    "reference": "Cp6eOTd2/7c=",
    "created_at": "2026-03-18T18:37:25.667321Z"
  },
  "permissions": {
    "allowed_operations": [
      "file.write",
      "financial.transaction"
    ],
    "financial_daily_limit": null,
    "financial_single_tx_limit": 500.0,
    "actions_require_confirmation": []
  },
  "derived_agents": [
    {
      "agent_id": "bad52c32-3afd-4e85-8ba6-c7c2ce2cadca",
      "purpose": "fixture-agent",
      "created_at": "2026-03-18T18:37:37.026154Z",
      "parent_sac_id": "fc294f3d-de2a-419c-b285-eed4049707f3",
      "derived_key_id": "72d6534c945dea42",
      "permissions": {
        "allowed_operations": [
          "file.write",
          "financial.transaction"
        ],
        "financial_daily_limit": null,
        "financial_single_tx_limit": 500.0,
        "actions_require_confirmation": []
      },
      "revoked": false,
      "revoked_at": null
    }
  ],
  "recovery_method": null,
  "recovery_params": {},
  "crypto": {
    "kdf": "pbkdf2-hmac-sha256",
    "iterations": 100000,
    "salt": "wlpeiFKa6u67dNp5aGSJOA==",
    "nonce": "pn7WOgwIgRre3M34Aocm5g==",
    "mac": "f87ae0da0081d9719b437c6d782c251110408729c9ff31a7fc136b9a29225fbf"
  }
}